{
  "schema_version": 1,
  "observed_at_commit": "c3133ff15ab3d46f33a1bcb5272c1c7d8b2845ad",
  "id_policy": {
    "block_pattern": "^MBLK-[0-9]{3}-[A-Z0-9-]+$",
    "edge_pattern": "^MBEDGE-[0-9]{4}-[A-Z0-9-]+$",
    "rule": "Mechanism blocks describe verified semantic handoffs across canonical GSI systems; they never create systems or certify parity."
  },
  "blocks": {
    "MBLK-001-SELL-MISSION-AUTHORITY": {
      "name": "Sell mission authority and reverse buildup",
      "owner": "GSI-09.14",
      "participants": [
        "GSI-05.03",
        "GSI-09.12",
        "GSI-09.14",
        "GSI-14.08"
      ],
      "contract": "An accepted building sell enters a durable three-state mission. Reverse buildup and animation completion, not command receipt, gate final sell completion while the building remains live.",
      "activation": {
        "mode": "command",
        "stock_status": "STOCK_ACTIVE",
        "trigger": "The local player issues an accepted sell action for a live owned building.",
        "stock_fixture": "Sell a stock GAPOWR in an ordinary skirmish after it has completed construction.",
        "guards": [
          "The selected object is a live owned building.",
          "Sell acceptance and eligibility gates are not yet exhaustively mapped in this pilot."
        ]
      },
      "inputs": [
        {
          "name": "accepted sell action",
          "detail": "The admitted player action assigns the selling mission.",
          "producer_systems": [
            "GSI-14.08"
          ]
        },
        {
          "name": "mission substate and animation completion",
          "detail": "The selling mission owns its substate and observes the completion byte.",
          "producer_systems": [
            "GSI-09.14"
          ]
        },
        {
          "name": "reverse buildup timing",
          "detail": "Building presentation state seeds reverse buildup and advances the completion gate.",
          "producer_systems": [
            "GSI-09.12"
          ],
          "external_source": "Retail BuildupTime and make-SHP frames"
        }
      ],
      "authority": [
        {
          "aspect": "command",
          "owner": "GSI-14.08",
          "detail": "Admits the player sell action."
        },
        {
          "aspect": "state",
          "owner": "GSI-09.14",
          "detail": "Owns the three-state selling mission and completion observation."
        },
        {
          "aspect": "lifecycle",
          "owner": "GSI-05.03",
          "detail": "Owns live, uninitialization, and removal lifecycle; the sell mission relies on the building remaining live until completion is authorized."
        },
        {
          "aspect": "ordering",
          "owner": "GSI-09.14",
          "detail": "Orders start, occupant or crew consequences, reverse buildup, wait, and completion."
        },
        {
          "aspect": "presentation",
          "owner": "GSI-09.12",
          "detail": "Owns reverse buildup animation timing."
        }
      ],
      "steps": [
        {
          "order": 1,
          "system": "GSI-14.08",
          "action": "Issue and admit the sell action."
        },
        {
          "order": 2,
          "system": "GSI-09.14",
          "action": "Selling state 0 clears completion, broadcasts start, clears conflicting animation, and advances."
        },
        {
          "order": 3,
          "system": "GSI-09.14",
          "action": "Selling state 1 applies crew or occupant consequences when applicable, broadcasts or plays the sell cue, and advances."
        },
        {
          "order": 4,
          "system": "GSI-09.12",
          "action": "GrandOpening(0) seeds reverse buildup and clears animation completion."
        },
        {
          "order": 5,
          "system": "GSI-09.14",
          "action": "Selling state 2 waits for animation completion before emitting final sell completion."
        }
      ],
      "outputs": [
        {
          "name": "sell completion gate",
          "detail": "The selling mission may enter the refund and teardown transaction only after reverse buildup completes.",
          "consumer_systems": [
            "GSI-09.14"
          ]
        },
        {
          "name": "live reverse-buildup selling state",
          "detail": "The player sees the building reverse its buildup while it remains part of the live world.",
          "player_visible": true
        }
      ],
      "critical_semantics": [
        {
          "kind": "lifecycle",
          "status": "VERIFIED",
          "basis": "native-binary",
          "detail": "Sell command receipt does not immediately destroy, remove, or refund the building.",
          "evidence": [
            "docs/research/traces/2026-07-25-loop-012-power-outage-recovery-trace.md:59-94"
          ]
        },
        {
          "kind": "timer",
          "status": "VERIFIED",
          "basis": "mixed",
          "detail": "Reverse buildup timing is driven by type and asset data; the stock GAPOWR fixture uses its make animation rather than a fixed universal delay.",
          "evidence": [
            "docs/research/traces/2026-07-25-loop-012-power-outage-recovery-trace.md:75-120",
            "ini/rulesmd.ini:42",
            "ini/artmd.ini:3206-3211"
          ]
        },
        {
          "kind": "same-tick",
          "status": "UNCHECKED",
          "basis": "unverified",
          "detail": "The exact scheduler pass in which the completion byte becomes visible to Mission_Selling remains unverified."
        },
        {
          "kind": "rng",
          "status": "UNCHECKED",
          "basis": "unverified",
          "detail": "The pilot has not exhaustively proven whether all sell-start side effects consume no gameplay RNG."
        }
      ],
      "loop_memberships": [
        {
          "loop": "LOOP-012-POWER-OUTAGE-RECOVERY",
          "stage_orders": [
            1,
            2
          ]
        }
      ],
      "native_anchors": [
        {
          "symbol": "BuildingClass::Mission_Selling",
          "address": "0x00449C30",
          "evidence": "docs/research/traces/2026-07-25-loop-012-power-outage-recovery-trace.md:59-94"
        },
        {
          "symbol": "BuildingClass::GrandOpening",
          "address": "0x00447780",
          "evidence": "docs/research/traces/2026-07-25-loop-012-power-outage-recovery-trace.md:75-120"
        },
        {
          "symbol": "BuildingClass::UpdateAnimation",
          "address": "0x004509D0",
          "evidence": "docs/research/traces/2026-07-25-loop-012-power-outage-recovery-trace.md:75-120"
        },
        {
          "symbol": "BuildingTypeClass::LoadVisualAssets",
          "address": "0x0045F230",
          "evidence": "docs/research/traces/2026-07-25-loop-012-power-outage-recovery-trace.md:75-120"
        },
        {
          "symbol": "Math__ftol",
          "address": "0x007C5F00",
          "evidence": "docs/research/traces/2026-07-25-loop-012-power-outage-recovery-trace.md:75-120"
        }
      ],
      "rust_surfaces": [
        {
          "path": "src/sim/production/production_sell.rs",
          "symbol": "sell_building",
          "coverage": "representative",
          "observed_at_commit": "c3133ff15ab3d46f33a1bcb5272c1c7d8b2845ad"
        }
      ],
      "research_query": "BuildingClass Mission_Selling sell reverse buildup GrandOpening UpdateAnimation completion byte power plant",
      "evidence": [
        "docs/research/traces/2026-07-25-loop-012-power-outage-recovery-trace.md:59-120"
      ],
      "open_questions": [
        {
          "detail": "Does animation completion become observable in the same scheduler pass or the next pass?",
          "impact": "EXACTIFICATION-RESIDUAL"
        },
        {
          "detail": "Abort, cancel, destruction-during-sell, and survivor-placement failure paths are not closed.",
          "impact": "UNKNOWN-RISK"
        },
        {
          "detail": "Save/load persistence of selling mission and reverse-animation state is not mapped.",
          "impact": "COMPOUNDING"
        }
      ]
    },
    "MBLK-002-SELL-REFUND-COMMIT": {
      "name": "Sell completion refund and teardown transaction",
      "owner": "GSI-09.14",
      "participants": [
        "GSI-05.03",
        "GSI-09.01",
        "GSI-09.07",
        "GSI-09.14"
      ],
      "contract": "Only after sell mission completion, dirty affected derived state, compute the rules-driven refund, credit the owner, apply applicable completion consequences, then uninitialize the building. Damage alone does not health-scale the refund.",
      "activation": {
        "mode": "state-transition",
        "stock_status": "STOCK_ACTIVE",
        "trigger": "Selling mission state 2 observes its animation-completion gate.",
        "stock_fixture": "Complete the stock GAPOWR sell begun by MBLK-001.",
        "guards": [
          "The sell mission completion byte is set.",
          "The selling building and owner remain valid for the completion transaction."
        ]
      },
      "inputs": [
        {
          "name": "sell completion",
          "detail": "The durable sell mission authorizes the completion transaction.",
          "producer_systems": [
            "GSI-09.14"
          ]
        },
        {
          "name": "refund configuration",
          "detail": "Type cost, owner cost modifiers, and General RefundPercent determine the amount.",
          "external_source": "Retail TechnoType cost and merged rules RefundPercent"
        }
      ],
      "authority": [
        {
          "aspect": "algorithm",
          "owner": "GSI-09.14",
          "detail": "Computes and orders sell-completion consequences."
        },
        {
          "aspect": "ordering",
          "owner": "GSI-09.14",
          "detail": "Orders derived-state dirtiness, refund, special completion effects, and UnInit."
        },
        {
          "aspect": "state",